,text
0,We are definitely not interested in
1,You know what? I don't want to do this
2,Do not call
3,"if you're trying to tell me a bunch of junk anymore, don't call it more."
4,Please don't call me again
5,I don't want you to take any information
6,I don't need a
7,I run a business and I get about 20 calls a day from y'all.
8,Please set me off your list.
9,I can't participate with anything
10,"I've asked about 1,000 times to have my number taken off of your list"
11,I'm not interested in overshoring
12,I'm not really interested in
13,Can you remove my number from your...
14,fucking bother fucking ass lackin' in the morning. This is shit.
15,"No, be honest with you. I don't need anything."
16,I don't need your insurance
17,I'm still on the no call list
18,please take me off the list.
19,"No, thank you"
20,Y'all are scammers. Stop calling me.
21,". I'm just talking about your do not call list, please."
22,Now why don't you go fuck a pig?
23,Would you please not call my number again
24,Remove him from your
25,This is like the seventh or eighth time you're told.
26,Do not call us.
27,Go fuck yourself!
28,"Take me off your call list,"
29,I've asked you guys several times already to take me off your call list.
30,I'm not interested in a life insurance.
31,No. Thank you
32,you've got to remove my number from your list. I'm going to have to remove my number from your list.
33,"No, I don't want to let it return"
34,I'm not interested in nothing like that.
35,"No, thank you."
36,I'm not really interested
37,I'm fucking horrible since you called. You called to put me on the call list.
38,put me on your national do not call list.
39,Take the off the list.
40,You have the wrong number.
41,This is a hospital room.
42,Will you please quit calling me
43,I don't appreciate this call.
44,You guys keep calling.
45,but y'all just keep calling and calling and calling.
46,I don't need no business.
47,y'all do not call.
48,Shut up!
49,I'm going to take off our number.
50,I don't need that.
51,Stop calling.
52,bitch.
53,"I'm good, motherfucker."
54,This is a hospital
55,take me off your list
56,Every fucking day.
57,Take me off your list right now.
58,Pick my name off the list please.
59,I'm tired of getting phone calls.
60,I want you to remove my number from your call list.
61,I don't want to talk to you
62,You need to get this number off your list.
63,I don't need no money.
64,I don't need any of that right now.
65,I don't think I need it
66,I'm not interested in it. 
67,"Becky, shut the fuck up"
68,Please remove this number from your listing.
69,Shut up.
70,I don't need that
71,So take me off your list.
72,Can you take my name off this?
73,can you take my number out of
74,"No, I'm not interested"
75,I don't need that. I don't need tha
76,Take the FU list.
77,quit fucking calling me
78,you can just fuck off
79,We don't need anything.
80,Is this a spam call
81,So you can take me off your little list.
82,I don't need a fee.
83,Take me off of your call list.
84,I am not interested in health insurance.
85,I don't need funeral expenses
86,I don't need this
87,Remove me from your calling.
88,"Becky, no more calls please."
89,I don't want to do this
90,you're calling a hospital home
91,Don't need it
92,I'd like you to quit calling me
93,"You guys called me on Friday, and I asked them then to take me off your calling list."
94,I don't need no insurance.
95,Why do you keep calling me
96,Can you take me off the call list?
97,"no, I don't need you"
98,"No, I'm not."
99,"No, no."
100,please remove me from your list.
101,I don't believe I need that.
102,. I'm not interested
103,Please stop calling.
104,We wouldn't be interested in any insurance
105,It's not in your business.
106,Leave me alone.
107,Please don't call here.
108,off your list
109,Don't call back.
110,Can you remove me from your callers
111,Take me off the coldes
112,It's a third time you people call me
113,shit
114,I told you not to call me
115,Could you take my name off your list?
116,None of your fucking business.
117,So quit wasting my time.
118,I'm going to go fuck yourself.
119,"No, no, no,"
120,I'm not impressed with that.
121,I don't need to do that.
122,remove this number from your calling list.
123,Take us off your calling list.
124,"No, I wouldn't."
125,This is a business.
126,I just wish you guys stop calling me just a waste of all of our time then.
127,You're not going to get anything out of me. I'm not holding up. Goodbye.
128,I don't need any benefits.
129,Don't call again.
130,And I feel like y'all harassing me
131, I'm not interested.
132,"No, I am. No,"
133,I want you to take my number off.
134,take me off the call-up please
135,You take me off your call list
136,you can remove me from your call list.
137,take my number out this
138,I think you've got a wrong number.
139,I don't need final expense insurance.
140,"Oh, no, thank you"
141,I think you're calling the wrong person for our company.
142,I fucking said no.
143,I'd like to be taken off the stand call.
144,I said fuck you.
145,you stop calling me.
146,please do not call me again.
147,can you take me off the list
148,Don't call me.
149,I don't need your money.
150,"I don't give a shit, don't go to hell."
151,no life insurance.
152,I'm not even ready.
153,put me on a do not call this.
154,I am not interested
155,I think you caught wrong place
156,Five people call me to while you want over the same thing they don't tell you
157,Is this a real person or a fucking computer
158,"No, it isn't."
159,Stop calling my phone moron.
160,"No, thank you. That's okay. Thank you for calling."
161,", I'm not interested"
162,Don't call me back.
163,you need to stop calling.
164,I'd like to learn more about your grandma's asshole
165, I want you to get my number off this column list. 
166,I don't want you to fucking call me no more at home.
167,Stop calling here.
168,Can you guys please stop calling me?
169,"You keep calling a business. You just call me about three, four times a day."
170,Stop calling my ****
171,Can you take me off your list
172,"If you ever call me again, I'm going to please put you in jail."
173,I'm not interested in
174,I'm not interested in any life insurance.
175,"I'm a fucker, it has called me about 20 minutes ago."
176,do not want no life insurance
177,Please take this number off the list
178,fuck
179,"Maybe when I'm dead, I have no way of knowing if I'll pay for it and when I get. So that's why I don't go for that."
180,I think you got the wrong number.
181,So I don't really need to get in
182,"You call me last night,"
183,I'm not interested in any insurance
184,I don't need no of that.
185,Can you remove me off your card and list
186,Please take me off the call list.
187,I don't need any insurance.
188,Do not call me.
189,"No, no. I'm sorry."
190,I'd like to learn more about this scam
191,So please take me off your call list or I'll report you guys.
192,Please take us off of your...
193,do you enjoy wasting my time every day
194,"No, no, no, thank you. Goodbye."
195,Take us off your list
196,". I don't need insurance,"
197,please don't bother me again.
198,Can you take me off your phone list?
199,Take me off to this
200,quick. Call me.
201,I don't want
202,I'm going to hang up.
203,I don't need license insurance.
204,But you don't need to call me no more
205,I'm going to report it to whoever I can report it to from the police department to FCC and everybody else. Do not call.
206,You're a piece of crap.
207,I wish you would stop calling.
208,"James, shut up."
209,No ma'am
210,Please take this number off of your list
211,You call me 10 damn times about this
212,I'm not interested 
213,y'all keep calling.
214,I'm not answering that.
215,Please take me off your list.
216,I don't buy stuff for people that call me on the phone.
217,"No, not at this time,"
218,"No, bitch. Hang up."
219,How do you keep on calling people bullshit
220,Let the fuck up the dog home and fucking phone asshole.
221,I keep people don't call me anymore.
222,Please quit calling. Please quit calling.
223,I'm going to fuck you in my ass.
224,your not supposed to call me by me Senior Benefits.
225,Stop calling my phone
226,Please put me on the do not call.
227,Please lose my number.
228,I'm just not ready to decide. But thank you for telling. I'm not ready to decide.
229,I don't need to
230,I don't know.
231,Put me on your do not call it.
232,I'm not interested in this.
233,Why you people keep calling me?
234,"Well, I'm not really ready for that now. So I'm going to hang up. Thank you."
235,"Oh, I'm not interested"
236,I don't need anything right now.
237,Would you please take me off of your call list? I'm tired of getting these phone calls.
238,I'm not interested in that.
239,is there any way that you can take me off your list of people to call?
240,We're not interested. I
241,take me off your list.
242,Don't need it. Don't need it.
243,And I would like if you please don't call us again
244,Don't need anything.
245,Put me on your do not call list
246,I want to fucking tell you and I find you and beat this fucking shit out of you.
247,You can put me on your do not call it.
248,Could you please take me off your list?
249,I'm going to turn you in for a vast mess.
250,you guys call me about four or five times a week.
251,Is illegal?
252,Not interesting
253,Stop calling me. Fuck off.
254,Take this number off your call list.
255,"but no, thank you."
256,You can take me off
257,How many times you gonna call me?
258,You got the wrong number
259,Can you stop calling me?
260,Can you please take me off the list?
261,I don't need no more
262,Why don't you suck a dick?
263,You want to fuck?
264,I'm all shit.
265,I'm not really interested.
266,Do you need to speak to someone in the braces side or general dentistry?
267,take me off and calling Leah.
268,Please take me off your
269,I'm still not interested.
270,I asked you not to call me again.
271,Can you not stop calling here
272,Could you take my number off your
273,"you just call me yesterday,"
274,"I'm not interested, ma'am"
275,What do I have to do to get you to stop calling?
276,Have to keep calling me
277,I don't want to talk about burial right now
278,don't call me again.
279,I'm doing pretty good with your fucking cock check out.
280,Why do you all keep calling me?
281,I don't want to remove my number from your call list.
282,Please stop calling
283,"I'm not ready to take on another expense. So no, thank you."
284,you guys call me a thousand times a day.
285,. I wish you would never call me again.
286,I'll be real good when you take my name off the list.
287,If you're a please take her off the call list and quit calling.
288,How about y'all quit fucking calling me?
289,Please keep an eye on your list.
290,You're a goddamn company.
291,I really am not interested.
292,I don't need all of that
293,no thank you.
294,your calling the business.
295,Why do you keep calling me? I don't want you to call me.
296,I'm not interested with this time.
297,Can you remove this number off y'all's list? This is a business.
298,"you're a phony and a fraud, so stop calling."
299,I wish every one of you people would take me off your list and put a call in the every single day.
300,"No, I don't need it. I don't need it."
301,Please don't call me back again
302,don't call back
303,I'm not interested in anything
304,Do not call this.
305,The guy that called me this morning
306,But take me off the list
307,why don't you just tell me what you want and then take my name off your call list
308,I'm worth a shit. I'm still alive and kicking.
309,you people have called me like 20 times a day. I'm getting tired of it.
310,I'm not interested in these
311,"We're not interested,"
312,Can you take me off the list?
313,"We don't need anything,"
314,check my name off this call and list
315,This is a scam call.
316,I wish everybody would stop calling me.
317,never call me again
318,"I'm not ready to die yet Becky, but I appreciate it."
319,I'm not ready
320,I don't need them.
321,". No, I cannot use it. Thank you."
322,I'll take me off your phone list.
323,No thank you.
324,Don't call me again
325,don't call me anymore.
326,Could I get put on the do not call
327,How won't you put me on a no-call list?
328,You said you wanted to lick my asshole.
329,why don't you just fuck off?
330,How do you take me off of your call list
331,We... You call the business
332,Don't call me again.
333,This is harassment.
334,I don't need any of that.
335,I don't need insurance.
336,you got the wrong number motherfucker.
337,you got to stop calling me
338,This is the 10th call. Do not call me again.
339,"No, I'm not looking for that."
340,I don't think I was interested.
341,I don't need to serve your service.
342,you guys keep calling me
343,You guys need to quit calling
344,I am not interested in any kind of insurance
345,I don't want to know a goddamn thing. 
346,Can you guys stop calling this number please?
347,I told you not to keep going
348,"No, no, no, no, no, no. I don't want it."
349,So don't call me back.
350,I don't need that to help my own financial estate.
351,Y'all quit calling me
352,. No. No. No.
353,"Never mind, no"
354,"Hey James, go fuck yourself."
355,We wouldn't be interested.
356,This is the business center.
357,Would you please put me on Do Not Call?
358,No need.
359,I'm not interested. I'm not interested.
360,"No, I don't need any new benefits"
361,"No, I didn't buy anything."
362,I don't need your benefits.
363,this is a hospital and we need this number removed from your
364,I don't deal with the phone.
365,You please take me off your calling list
366,Can I go on a do not a call list?
367,I don't need none of that.
368,please stop calling in.
369,please remove my number from your call list.
370,Why would I be getting these calls every two minutes?
371,I want to speak to a representative
372,"Can you take this number off the call list,"
373,"I think you've got the wrong number,"
374,I don't need your
375,you can remove the phone number?
376,Is there any way y'all could take my number out this
377,I don't need those license services.
378,don't call here.
379,you're calling to another main treat school.
380,Every day you bother me.
381,I don't really like insurance.
382,don't call me back. Take my name off.
383,I'm not interested in this
384,Don't pay us to shove them up your ass.
385,what the fuck do you want?
386,Why do you keep calling me?
387,I am not interested in it
388,I am not interested in a life insurance.
389,Can you stop calling my line?
390,"I don't need insurance now,"
391,My name and number off of your list.
392,stop calling
393,"No, no, no. I don't need all of that. Thank you very much"
394,Take me off your list.
395,you are damn liar.
396,Will y'all please stop calling?
397,I don't need any more.
398,just fuck yourself.
399,Rather take me off the
400,we wouldn't be interested.
401,I don't think I'm interested.
402,We don't need it.
403,"could you please take my number off your list, please?"
404,Would you please take me off your call
405,Take me off your list please.
406,You've stolen somebody's telephone numbe
407,I don't need any senior benefits
408,please stop calling this number. I would appreciate it.
409,I wouldn't be interested in it.
410,You take my name off your list.
411,Take me off your call.
412,"No, I'm not interested."
413,I must tell what police quit calling. I don't need anything.
414,That's not okay.
415,this is a do not call number.
416,it's a scam.
417,I'll take the action off you.
418,No. Thank you.
419,I have a number you dumbass.
420,I don't want to take out any more issues.
421,You just called me 10 minutes ago.
422,Don't call in my phone.
423,This is a business
424,I don't want any more calls.
425,"If you can stop calling, I'd appreciate it."
426,I don't need no final expense.
427,please don't call me back.
428,you have called me before.
429,I've done talk to 20 people a bit about that
430,not interesting
431,We're not interested.
432,but I'm not interested right now
433,You don't need to call back no more.
434,you did that crap.
435,I don't need life insurance
436,Quit calling me all the time.
437,Quit calling me
438,I'll be a lot better if you guys could call me all the time
439,Please take me off your calling list.
440,I think we won't be interested.
441,I wish I could quit calling me six times a day.
442,Just take me off the call
443,motherfucker
444,Can you take us off your phone with you
445,please take my name and number off of your calling list.
446,take us off your playlist.
447,Please remove me from your call list.
448,I don't want none
449,stop calling me.
450,I'd like to be removed from
451,You need to put me on your no-call list.
452,Don't be calling me dirty motherfuckers.
453,I don't like deals over the phone
454,so take me off the list
455,I do not need that.
456,I don't need any information.
457,that already called me today
458,"No, not interested. Not interested"
459,Thanks for fucking talking about me.
460,I'm not interested in...
461,You've called the place of business.
462,Don't need any Becky
463,Please remove this from your list.
464,I would be real good if people would quit calling me from Senior Benefits.
465,Put me on your DNC list.
466,"Oh, I wouldn't."
467,I've asked you guys to stop calling me.
468,I'm not.
469,I don't need it 
470,Taking off your goddamn list.
471,I want you to stop calling me
472,I won't need it.
473,I'm going to talk to you and quit calling.
474,"Shut up, bitch."
475,"this numbers on the do not call list, so please do not call."
476,. Fuck all you
477,If you guys stop calling me please.
478,I won't need it
479,"I don't need any help. We have our plot, we've got everything"
480,I'm just not interested.
481,please stop calling us.
482,You can take this phone number off your list
483,you just call a while ago.
484,"No, I wouldn't"
485,You're calling me several times because please stop calling me.
486,"No, I'm not ready"
487,Don't call this number number.
488,I don't need that stuff anymore.
489,I'd be great if you ain't just fucking calling me.
490,I appreciate if you would take me off your call list
491,you might have the wrong number
492,I am not interested in this.
493,m not interested in buying.
494,I don't need
495,please stop calling me
496,No. No.
497,I don't need anything.
498,"you're not leaving me alone, are you?"
499,"Would you take me off your list,"
500,Can you please remove my number
501,You'll call me like five million times.
502,no. Thank you.
503,I cannot afford
504,I don't need no damn senior benefits.
505,I don't want any
506,we're not interested
507,You move my number to your lead.
508,Could you please take me off your list
509,Would you please take me off your call list? Thank you.
510,Could you take my number off
511,Can you put me on the
512,you call me every day
513,No. Okay.
514,Not fucking cool
515,I don't think about it.
516,you're calling an elementary school.
517,Nope.
518,"can you take this number off your call-up, please"
519,Why do you keep on calling me?
520,"Don't call this number again, put on your no-call list."
521,I'm not interested in insurance.
522,I do not need any more.
523,Take me off your call
524,Take my name off.
525,Eat a fat bag of dicks and go suck a fucking
526,you're calling a hospital.
527,I've asked you repeatedly not to call me anymore.
528,You stupid sandnegger!
529,don't call no more.
530,Can you please quick calling?
531,I'm not going to tell you.
532,Take me off your lips.
533,"put me on the do not call us, and don't call me that."
534,I asked you guys to stop calling my numbers.
535,Not worth a damn. I'm tired of y'all calling.
536,I can tell them to go fuck himself.
537,Please don't call this
538,I don't need a license insurance
539,Who's the fucking carrier?
540,None of you are fucking business.
541,I don't give out personal information.
542,do not call again
543,I don't need anything like that
544,fuck yourself.
545,"Fine, but I don't need any senior benefits"
546,You're a line sack of shit scammer.
547,Quick calling
548,I am not interested in this right now.
549,quick calling here. 
550,fuck.
551,you can take me off your phone list.
552,Take me off the list
553,I'm getting you the wrong number.
554,you've called me a hundred times.
555,Do not call me again.
556,. I don't need any more
557,I ain't a fucking senior.
558,Stop calling people. You're really annoying.
559,please don't call me no more.
560,Take my name off your list.
561,I don't need nothing like that.
562,you removed me from your list
563,What the fuck
564,we're not interested at all
565,"No, thank you. Bye"
566,please don't call again.
567,you guys will stop calling me.
568,Can you remove me from your calling list?
569,You realize you're calling Erie Insurance with this scam
570,you guys stop calling.
571,I have been asked to have my number removed from this call list.
572,I don't need another insurance.
573,we don't need any life insurance
574,Doesn't need to be called by anything. It's a business. Please don't call us number again.
575,you guys keep calling me all the time. Can't you take me off your damn list?
576,You're calling off of a spoofed number.
577,"No, that's okay"
578,Would you take me off your call
579,I would like to be taking off your call list.
580,Please stop calling me.
581,so quit sussin' call on me.
582,", I'm not interested."
583,we are at the restaurant. Now we are giving the business hour.
584,I'm not going to give you any information
585,I don't want to answer.
586,Don't fucking call my motherfucking phone again
587,Leave me alone. Take me off your call list.
588,just take me off that
589,I will contact if you do not quit calling this number or race this number.
590,"I mean, why do you all even call me"
591,You stupid motherfucker.
592,"I'm not interested,"
593,I'm fine as long as you people stop calling me. I get so many damn calls.
594,You're calling list.
595,Please put me on a do not call list.
596,"No, not right now."
597,"No, I don't need it"
598,This is a business line.
599,I've told you to freak easily that to call me.
600,I'm not interested in thank you.
601,"Oh, no, thank you."
602,I am not interested.
603,I don't need you.
604,"No, no, no, no, no."
605,Will you please stop calling me
606,we don't need it.
607,please take me off the call list.
608,I'm not fucking calling you.
609,Quit calling me.
610,I'm not interested in benefits.
611,"I'm not going to tell you,"
612,I don't need any insurers from you
613,I'm not interested in that
614,please quit calling.
615,I can't afford nothing right now
616,I don't want to talk about that.
617,I don't want to participate in anything.
618,Please take me off of your land
619,I wish you all a quick calling here
620,Put me on the do not call
621,"don't need anything,"
622,I don't need life insurance.
623,I'm on the National Do Not Call for a S***.
624,Will you stop calling this number?
625,Quick calling me
626,I appreciate not getting the calls.
627,I've had a lot of people call
628,You can fuck you.
629,I'm going to talk to you about your representative.
630,"No, I'm really not interested, ma'am."
631,I would like to be placed on the do not call list
632,"I don't like these calls. You guys keep calling me all the time,"
633,So you don't have to call me more with this. So you don't have to call me more with this.
634,You guys comment 10 times a day.
635,We are pleased to stop calling me by some senior benefits.
636,I'm not interested in life insurance
637,Don't call me with that. Don't call me with that no more.
638,you need to take me off of your call list please.
639,please stop calling me.
640,i'm not interested.
641,I think you called it wrong number. This is Ross's store
642,I don't need any other.
643,I don't need a third one.
644,People keep calling me. It's driving me crazy.
645,I don't need none
646,Please delete my number
647,stop calling over here.
648,You've been calling me every day.
649,if you took me off your call list
650,you keep calling me.
651,Don't call no more.
652,somebody already called me about that. Okay.
653,don't bother calling me.
654,And you go fuck yourself James?
655,Don't call this number.
656,"Good, bitch, I don't give a damn who you are, bitch. Stop calling my goddamn..."
657,I'm not interested in any.
658,So would you take me off your list
659,Same as I was last time you called.
660,Can you put me in a not cold list
661,I'm not
662,I am having sex with your mom.
663,I'm totally uninterested.
664,I keep asking people to take me off.
665,Please don't ever call me anymore
666,Would you please take me out for your ear?
667,Don't call here. No more. Don't call here.
668,"What do you want you Indian motherfucker, stop calling me"
669,"Could you please take me off the call list,"
670,"No, no, no"
671,"No, no, I don't need"
672,Please take us off your
673,Will you take me off to this?
674,Y'all done called 15 times this morning.
675,wouldn't be interested in that anyway.
676,Please don't call me any more.
677,How many times are you going to call me?
678,I just had a call from now about 30 minutes ago.
679,You don't need to call me no more
680,you don't have to do all that crap.
681,So what would you like to learn how a partner appreciate that motherfucking piece shit?
682,I'm not interested in the program.
683,Did you call me last week too?
684,So please remove our name
685,"Oh, but I'm not interested."
686,"No, no, no, no. Don't call anymore. Don't call me."
687,Your bothering me.
688,"No, no, thank you."
689,This is the third time you guys are called
690,None of your business.
691,"No, I'm not"
692,take my name off of your calling list.
693,No. Stop calling.
694,Please don't call me again.
695,Thank you for calling Sandy a laboratory federal credit.
696,Fuck you guys. Stop calling.
697,You want to see guys be called every day? You've already called once today.
698,you call me 15.
699,wrong number.
700,no. I'm not ready.
701,I've only had over 100 calls.
