,text
0,please quit calling me
1,Please take this number off the list
2,"You were supposed to take my name off the call list,"
3,take me off to this
4,fuck
5,please remove our number from your
6,I'm not interested in this
7,Can you take me off the list?
8,I'm getting you the wrong number.
9,I appreciate if you would take me off your call list
10,this is a four-time job trying to scam people in. I mean...
11,I have no interest in a final expense.
12,Take me off your calling list
13,so you can take me off your list.
14,I'd like to be removed from
15,I don't want to take care of that.
16,"No, no, no, no. Don't call anymore. Don't call me."
17,Eat a fat bag of dicks and go suck a fucking
18,Motherfucker. Is your mama 40?
19,You're a goddamn company.
20,I would appreciate you guys not calling me anymore.
21,"If you could remove my name, it'd save us both some time."
22,Please take this number off your list
23,Please take me off your calling list.
24,I don't need no money.
25,"You guys called me on Friday, and I asked them then to take me off your calling list."
26,I am not interested.
27,I don't know why you guys keep calling me.
28,I don't need a
29,don't call me
30,Will you let me fucking talk
31,"I'm not interested, ma'am"
32,Thank you so much for connecting with the Unlule Insurance Coats on our recorded line.
33,"We don't need anything,"
34,You're a piece of crap.
35,. No. No. No.
36,I'm going to turn you in for a vast mess.
37,stop calling my phone number.
38,this is a business line.
39,I don't need to
40,you need to not call me anymore.
41,"No, it isn't."
42,Would you stop calling me
43,I don't think we've got anything to talk about.
44,"No, I don't need it. I don't need it."
45,I don't need none
46,I'm going to talk to you and quit calling.
47,take my name off of your calling list.
48,"Could you remove me off your list, please?"
49,this is a business phone
50,Not worth a shit. I just buried my wife and if you fucking people don't quit calling
51,"No, no, thank you."
52,I'm still on the no call list
53,you're talking to the wrong person
54,I don't need a third one.
55,Can you delete this number?
56,Please don't call it.
57,"Becky, no more calls please."
58,I don't need any of them
59,I'm trying to get tired of 100 people calling me every day.
60,"Well, I'm not really ready for that now. So I'm going to hang up. Thank you."
61,I would like to be taking off your call list.
62,I'm not interested in the program.
63,So would you take me off your list
64,quit calling this number as whole.
65,. I don't need this
66,"No, I don't think you have money to do that,"
67,I wish you guys a quick calling.
68,keep getting calls from you all.
69,I would like for you not to call me again.
70,I'm not interested in life insurance.
71,wouldn't be interested in that anyway.
72,Why do you guys call me every single day
73,Would you please take me off your call
74,I said fuck you.
75,I think you have the wrong number. I'm not.
76, I want you to get my number off this column list. 
77,I need you to take me off the list.
78,I don't need insurance.
79,I don't need any more.
80,your not supposed to call me by me Senior Benefits.
81,If you could take me off your list
82,I appreciate not getting the calls.
83,And I would also guarantee we go through this like three times a week. And I have repeatedly asked to be moved from your
84,Please take me after you call us.
85,Please don't call me.
86,"Can you take this number off the call list,"
87,take my number out this
88,"can you take this number off your call-up, please"
89,"No, not right now."
90,I don't need no insurance.
91,Do you like sucking dick?
92,You get the wrong number.
93,You need to go fuck yourself.
94,Don't call us.
95,Could you take my number off
96,No need.
97,take us off your list
98,I think you've got a wrong number.
99,Take me off your call list.
100,"No, I'm not interested"
101,. I don't need any more
102,I'm totally uninterested.
103,. I wish you'd take me off your list.
104,fuck off.
105,You've stolen somebody's telephone numbe
106,I'm really not interested right now
107,I got everything set up
108,Please take my number off your call list.
109,Please stop calling me
110,please put me on the do not call list because they call me 1200 times a day?
111,you people have called me like 20 times a day. I'm getting tired of it.
112,Don't call me again
113,I want to stop calling me.
114,Not worth a damn. I'm tired of y'all calling.
115,Stop calling.
116,you got the wrong number motherfucker.
117,m on the Do Not Call list.
118,", I'm not interested"
119,I don't give out personal information.
120,I've asked you guys not to call me anymore. So could you not call me anymore?
121,I don't need no burial law insurance.
122,"Go fuck yourself, yes."
123,"you just call me yesterday,"
124,You're not going to get anything out of me. I'm not holding up. Goodbye.
125,How about y'all quit fucking calling me?
126,Do not call this.
127,Take me off your
128,Take the FU list.
129,Leave me alone.
130,just take me off that
131, Not interested. 
132,I don't understand why they keep calling me
133,What kind of a damn phone?
134,not interesting.
135,You need to put me on your no-call list.
136,Take me off the coldes
137,put me on your do not call us?
138,I need to move my name from your list.
139,Stop calling motherfucker.
140,"I'm a fucker, it has called me about 20 minutes ago."
141,can you take my number out of
142,I don't like deals over the phone
143,I'm doing fancy quick calling.
144,That's none of your goddamn business
145,don't call me no more with it
146,So please remove our name
147,You want to see guys be called every day? You've already called once today.
148,I've asked him many times to take this number off your listings.
149,I'm not interested.
150,Did you call me last week too?
151,people like a son of a bitch.
152,"No, I'm not looking for that."
153,I've had a lot of people call
154,You call the business fine.
155,I just had a call from now about 30 minutes ago.
156,Can you remove me from your calling list?
157,Can you please take me off the list?
158,you need to take me off of your call list please.
159,I wish you guys would stop calling my number.
160,please remove my name from the list
161,I don't want to take out any more issues.
162,Taking off your goddamn list.
163,I think we won't be interested.
164,Don't call me again.
165,no life insurance.
166,can you take me off the list
167,I'm not interested in it. 
168,can you please take me off this list?
169,I'm not interested in any insurance
170,I don't need any benefits.
171,"Why don't you just hang up, you fucking idiot."
172,I don't think I'm interested
173,I don't need anything.
174,you call me 15.
175,. I don't need any insurance
176,"Would you take me off your list, please?"
177,Please lose my number.
178,but y'all just keep calling and calling and calling.
179,Don't call this number.
180,I run a business and I get about 20 calls a day from y'all.
181,I don't want it.
182,Please add me to your do not call list
183,Please don't call this number again.
184,Please stop calling me.
185,"We don't need it,"
186,I don't need to buy anything.
187,I am not interested in this.
188,Don't call again.
189,You need to get this number off your list.
190,no. Thank you.
191,"No, I don't think so."
192,"I think you have the wrong number,"
193,I'm doing pretty good with your fucking cock check out.
194,we don't need any benefits.
195,Will you take me off to this?
196,Don't pay us to shove them up your ass.
197,take us off your playlist.
198,Now why don't you go fuck a pig?
199,Please stop calling.
200,I don't need any interest
201,So I don't need it
202,Get this off the phone.
203,I don't think I'm interested.
204,Not interesting
205,check my name off this call and list
206,I'm not in the middle of your funeral.
207,I'm not interested in this.
208,I keep asking people to take me off.
209,So can you please remove the number
210,please stop wasn't calling me.
211,"No, we're not enticing this."
212,Can you take me off your phone list?
213,I'm going to talk to you about your representative.
214,I don't need those license services.
215,"No, thank you very much"
216,You don't need to call me no more
217,You're calling off of a spoofed number.
218,Stop calling this number.
219,please don't bother me again.
220,Could you pick me off the list?
221,I don't want to participate in anything.
222,Do not call
223,We are pleased to stop calling me by some senior benefits.
224,don't call here.
225,I don't need any more help.
226,take me off your list
227,"Oh, it only no interest"
228,"No, I'm not"
229,This is a business line. And I appreciate if you guys stop calling it.
230,I would like for you to quit tall on these scam likely.
231,Take us off your calling list.
232,"James, shut up."
233,I'm not an interest.
234,"No, I'm not interested."
235,we don't need it.
236,taking her off your calling list.
237,I think you have the wrong number.
238,Why do you guys keep calling me?
239,quick. Call me.
240,I don't need it
241,I don't need anything right now.
242,You're calling me several times because please stop calling me.
243,Please remove us from your list.
244,I want you guys to take me off here and do not call this.
245,fuck this shit
246,"If you can stop calling, I'd appreciate it."
247,Can you take me off to the police place
248,Can you take us off your call list please
249,Take the off the list.
250,Don't call me.
251,I don't need your insurance.
252,"No, I don't want to let it return"
253,I don't like this.
254,"Get out of here, scammer"
255,I don't need another insurance.
256,there is so many people keep calling.
257,None of you are fucking business.
258,And I would like if you please don't call us again
259,"No, I didn't buy anything."
260,Not really
261,"Can you get me up the list, please?"
262,Put me on your do not call list
263,"No, that's okay"
264,"Hey James, go fuck yourself."
265,Take me off the list
266,This is like the seventh or eighth time you're told.
267,Can you remove this number from your calling list?
268,"No, I'm not. No, I'm hang up. I'm hang up."
269,I don't need no business.
270,don’t call here again
271,I'm just like I was when you called me a couple hours ago. Bye bye.
272,you call me 17 times this and I told you that I answer.
273,I got to tell you people to take my name off your list
274,Don't call anymore.
275,I don't need none.
276,Can you back off?
277,Don't need it
278,can you please stop calling?
279,I'm not only no damn benefit.
280,you just call a while ago.
281,put me on your do not call list.
282,I'd like to be taken off the stand call.
283,"Don't call this number again, put on your no-call list."
284,stop calling
285,please never call me back again.
286,I am not interested in any kind of insurance
287,"I don't need any help. We have our plot, we've got everything"
288,Will y'all please stop calling?
289,we don't need any life insurance
290,Why do you keep calling me
291,would y'all take me off the list?
292,I don't need to be this. So stop.
293,I don't need nothing like that
294,"I want you to take me off my calling list, off your calling list."
295,I would like to be placed on the do not call list
296,I don't want to remove my number from your call list.
297,Are you removing my number from your call list?
298,I don't need it.
299,I'm not interested in the insurance
300,"At until we stop calling, yeah, got in somewhere."
301,Nope.
302,i'm not interested.
303,none of your business.
304,I do not want insurance.
305,I don't need all of that
306,I'm not interested in anything.
307,I'm not interested in any of that.
308,Could you take my name off your list?
309,I don't need this.
310,So did you get me on doing a call list? I also have to block.
311,"Oh, no, thank you."
312,Please don't call here again
313,I do not need any more.
314,Why do you keep calling me?
315,I'm not interested in this. I'm not interested in this.
316,don't call back
317,So I don't think I want to hear about anything.
318,m not interested in buying.
319,Could you please remove me from your call list?
320,Don't call me no more.
321,scam logs
322,I don't want to talk about that.
323,Every day you bother me.
324,Just take my number off your list.
325,Take me out your list
326,"No, I wouldn't"
327,"I told you even last week, don't call this number"
328,Don't call me back again.
329,"You guys have been calling me consistently,"
330,I can't afford nothing right now
331,Can you stop calling me?
332,Take my name off your list
333,Quick calling me.
334,You're speaking with a dispatcher at a business.
335,I'm not interested in insurance.
336,Take my name off.
337,I'm sick and tired of you people calling me every frickin' day.
338,I wish there was some way that we could get through to you to get you to quick calling us
339,Please stop calling
340,you guys call me about four or five times a week.
341,please don't call.
342,I don't need no more
343,I'm just not ready to decide. But thank you for telling. I'm not ready to decide.
344,Would you stop calling here?
345,No. Okay.
346,he buries his shit in the back yard when he takes a shit
347,So please don't call me no more.
348,you've got to remove my number from your list. I'm going to have to remove my number from your list.
349,Please don't call this
350,you got the wrong number.
351,I'll take me off.
352,Will you please stop. Call me.
353,I have been called twice today and numerous times yesterday and the days before. Please don't call again.
354,I'm going to ask again that you remove me from the call list and do not call this number again
355,"No, no, no, no, thank you."
356,I'm not interested in
357,Please do not call me again. Do not call me.
358,take me off of your call list
359,I don't know why you keep calling me.
360,you can remove me from your call list.
361,it's a scam.
362,Not really.
363,you have called me before.
364,I would appreciate it if he would stop calling me
365,Please don't call here.
366,What do I have to do to get you to stop calling me
367,that already called me today
368,Can you remove this number off y'all's list? This is a business.
369,Take me off your name and calling with us.
370,I don't need one.
371,would you quit calling me
372,"I think you have the wrong number, sir."
373,I don't need a license insurance
374,Please take me off this list.
375,Stop calling here.
376,stop calling me.
377,"No, I'd rather not."
378, I'm not interested in insurance
379,I don't need any insurers from you
380,Stop fucking calling me.
381,I want to speak to a representative
382,Take me off your list please.
383,Could you please take me off your list
384,I've asked to take my name off your call list.
385,I don't need your product.
386,not interested.
387,So you're going to call me every day?
388,"Well, stop calling. Well, stop calling."
389,I would be real good if people would quit calling me from Senior Benefits.
390,We don't need any of them.
391,wrong number.
392,I don't need that coverage
393,Can you put me out here? Do not call with
394,I want you to stop calling me.
395,"Take me off the call,"
396,You've called the place of business.
397,I'm not interested in that
398,Y'all won't stop calling me. So me and my husband is going to sue.
399,I don't need any.
400,Don't call me with that. Don't call me with that no more.
401,I'm still not interested.
402,Can you please take my number off this phone call?
403,"put me on the do not call us, and don't call me that."
404,I don't need the coverage
405,I'm not really interested in
406,And you rather the fucking guy. You fucked up.
407,This is the third time you guys are called
408,You just called me 10 minutes ago.
409,Stop talking.
410,please do not call this number again.
411,you guys call me a thousand times a day.
412,I don't need any information.
413,Rather take me off the
414,Can you quit calling me?
415,Don't call in my phone.
416,I don't need license insurance.
417,Can you take my name off this?
418,Please take us off of your...
419,Can you put me on the do not call
420,you guys keep calling me
421,I don't need to serve your service.
422,Can you take me off your list?
423,I don't need nothing.
424,Could you just remove me from this calling one
425,I'm not interested now.
426,I don't need two of them
427,Please remove me from your call list.
428,"No, bitch. Hang up."
429,"No, no, no, no, no."
430,I wish that you would just quit calling me.
431,just fuck yourself.
432,I'm not interested in.
433,you can just fuck off
434,I'd like my name removed from your call list
435,You must have the wrong number
436,We don't need not be.
437,I'm not interested in these
438,No. Thank you.
439,Delete this number.
440,Give your damn head. Don't call me.
441,please don't call me no more.
442,I don't need any of that right now.
443,I told you to quit calling me.
444,I'm not interested in...
445,"No, no, no,"
446,add me to your do not call list.
447,It's fucking morning.
448,"Fuck y'all,"
449,I wish you all a quick calling
450,"Could you take me off your call list,"
451,it was known for damn good.
452,"No, no, no"
453,How come you keep calling me?
454,Please don't call here anymore.
455,harassment. Every five minutes I get a phone call from you guys.
456,"No, thank you"
457,I don't need any additional insurance. Thank you
458,I'm not really interested
459,Stop calling me.
460,I don't think I need it
461,I think you're calling the wrong person for our company.
462,take me off the list.
463,You said you wanted to lick my asshole.
464,I'm not interested in it
465,I'm fine as long as you people stop calling me. I get so many damn calls.
466,Take my name and call me
467,I'm not really interested.
468,"Becky, shut the fuck up"
469,I'd like to learn more about this scam
470,I've asked you repeatedly not to call me anymore.
471,This is a business.
472,Once called Senior you fucking shag it.
473,Y'all are scammers. Stop calling me.
474,"What do you want you Indian motherfucker, stop calling me"
475,do not call this number again.
476,o could you please take us off your list?
477,I don't need no burial insurance
478,I don't need your help.
479,I'd be great if you ain't just fucking calling me.
480,This number is on the national do not call
481,Don't call us on her.
482,"Shut up, bitch."
483,No.
484,"Take me off your list, please"
485,I'm not answering that.
486,No. No
487,I wouldn't be interested in it.
488,Don't fucking call my motherfucking phone again
489,None of your business.
490,We're not interested.
491,do not call
492,I do not need that.
493,That's how I'm going to go fucking...
494,I won't need it.
495,I'm not going to give you that information.
496,Don't call here. No more. Don't call here.
497,Not interested
498,Take my damn phone number out of your
499,I wish all you guys the last time with quick calling my number. You're not calling me again.
500,I am not interested in it
501,I don't want to have that.
502,"Oh, I wouldn't."
503,"I don't want you to call me again, please."
504,Why don't you suck a dick?
505,do not need no interest.
506,I don't need any live insurance supplies.
507,I don't need final expense insurance.
508,Leave me alone. Take me off your call list.
509,"You call me last night,"
510,"I'm not ready to die yet Becky, but I appreciate it."
511,you're calling a hospital.
512,"Oh, I'm not interested"
513,you called me this morning James
514,so quit sussin' call on me.
515,Who the fuck are you?
516,You stupid sandnegger!
517,take me off the call-up please
518,Please take us off your call list
519,"No, I don't like that."
520,I've only had over 100 calls.
521,please do not call me again.
522,I don't really like insurance.
523,can you remove me from this list
524,You have the wrong number. You have the wrong number. You have the wrong number.
525,Take me off your call
526,I'm not going to tell you.
527,"I'm not going to tell you,"
528,Please don't call me anymore.
529,do not call me back.
530,I told you not to keep going
531,Not interested.
532,stop calling.
533,I don't need any of the life insurance.
534,Thank you for calling Sandy a laboratory federal credit.
535,"No, thank you. Right now."
536,I'm going to hang up.
537,Stop calling my phone moron.
538,Shut up!
539,No thank you.
540,Do not call me again.
541,you get a carrot in sticking in your asshole
542,I don't need it 
543,I must tell what police quit calling. I don't need anything.
544,I'm not interested with this time.
545,Let the fuck up the dog home and fucking phone asshole.
546,You guys need to quit calling
547,would you people please quit calling?
548,I don't need no life insurance.
549,what the fuck do you want?
550,We don't need that.
551,I'm going to fuck you in my ass.
552,How do I get removed from your call list?
553,Could you just stop calling me
554,you keep calling me.
555,Please take me off your
556,I don't need no damn senior benefits.
557,You can take us off that call list
558,How do you take me off of your call list
559,"nd I wish it could put calling. Take me off your call list, please."
560,Not fucking cool
561,Take this number off your call list.
562,I want you to stop calling me
563,I am not interested. I'm not interested
564,Why in the world don't you quit calling me?
565,Please do not call me anymore
566,I don't want to talk to anybody.
567,Take us off your list
568,No. I don't care for it.
569,Do you need to speak to someone in the braces side or general dentistry?
570,please stop calling this number. I would appreciate it.
571,you can remove the phone number?
572,Can you please remove my number
573,I'm not going to give you any information
574,Can you put me in a not cold list
575,I think you caught wrong place
576,"No, no, no, thank you. Goodbye."
577,"this numbers on the do not call list, so please do not call."
578,I don't need no license.
579,take me off your list.
580,I've asked several times if you guys had quit calling me
581,please take me off the call list.
582,I don't need no final expense.
583,take my number out of your damn calling list.
584,Would you please take me off your call list? Thank you.
585,It's just a waste of time
586,How do I get off of this list?
587,I'm tired of phone calls. Don't...
588,Do not call me.
589,Would you take me off your call
590,Can you please stop calling my phone
591,Could you take me off your mailing list?
592,Please take me off your list.
593,"I don't like these calls. You guys keep calling me all the time,"
594,please don't call no more.
595,please just don't call again.
596,I don't need to talk to him.
597,And you guys call from so many numbers.
598,Take me off the list.
599,You seem to keep calling for some stupid reason
600,I don't believe I need that.
601,Please don't call me right here.
602,fucking
603,Can you remove my number from your...
604,I fucking said no.
605,you removed me from your list
606,I'm just not interested.
607,"No, ma'am,"
608,"Could you please take me off the call list,"
609,I don't need a fee.
610,You're calling me on the same different numbers all the time
611,I wish you all a quick calling here
612,Would you please take me out for your ear?
613,Please don't call this number again
614,I'm not interested in overshoring
615,This is a business office and industrialization specialist.
616,So quit wasting my time.
617,You move my number to your lead.
618,I don't want that.
619,I'm not ever going to die. You know... I'm not going to die.
620,Please take me off of you
621,Don't call no more.
622,this is a business
623,we're not interested.
624,So please take me off your call list or I'll report you guys.
625,I don't want to know a goddamn thing. 
626,I'm not interested in benefits.
627,I wish you would stop calling.
628,And quick calling me. You prick.
629,I would like for you to remove us from your call list.
630,". No, I cannot use it. Thank you."
631,Take my name off the call.
632,I know all day shit
633,"Kiss my ass. Stop calling this goddamn number, you fucking jackass."
634,don't call me anymore.
635,Please do not call here again.
636,I'm not buying them.
637,"how many times do you want to call, buddy"
638,off your list
639,. I'm not interested
640,You want to fuck?
641,If you guys stop calling me please.
642,"if you're trying to tell me a bunch of junk anymore, don't call it more."
643,"No, thank you. Bye"
644,"Oh, oh. No"
645,I don't need nothing like that.
646,Can you take me off the
647,I told them to take my name off the list
648,Why do you keep calling me? I don't want you to call me.
649,please don't call me back.
650,Do not call us.
651,I think you called it wrong number. This is Ross's store
652,I don't need your benefits.
653,It doesn't stop. It's like so annoying
654,I'm going to take off our number.
655,"Oh, no, thank you"
656,taking us off your call list
657,I'm not interested
658,Stop calling me with this shit.
659,I've actually all not to call me no more
660,I'm not interested though.
661,I don't need your service
662,"I'm good, motherfucker."
663,How many times you gonna call me?
664,You can fuck you.
665,You can put me on your do not call it.
666,I don't need that yet.
667,I don't want any more calls.
668,I don't want
669,Don't be calling me dirty motherfuckers.
670,And I feel like y'all harassing me
671,Please remove me from your call.
672,You guys keep calling.
673,"you're not leaving me alone, are you?"
674,bitches?
675,Why are you calling a business
676,I'm trying to get myself off the list.
677,Take this number off of your list.
678,put me on your national do not call list.
679,This is a hospital
680,I don't want none
681,It's a third time you people call me
682,Have to keep calling me
683,shit
684,You please take me off your calling list
685,Don't call back.
686,Please remove it from your
687,I just think you called the wrong number
688,We are definitely not interested in
689,I can't talk right now.
690,I'm not interested in nothing like that.
691,you don't call me one time today.
692,"I'm not ready to take on another expense. So no, thank you."
693,No. Stop calling.
