,text
702,"y'all just keep calling me, and I'm tired of it."
703,No.
704,I have asked you guys several times to stop calling me.
705,I don't need no live insurance.
706,"No, I don't think so. Thank you."
707,I don't want to take care of that.
708,I've actually all not to call me no more
709,I don't need any interest
710,If you could take me off your list
711,I have got this call so many times and it's so annoying.
712,"No, not at this time."
713,I don't need no shit. Let's get out of my phone.
714,Don't want to talk to you.
715,"Would you take me off your list, please?"
716,I wish all you guys the last time with quick calling my number. You're not calling me again.
717,I wish you guys a quick calling.
718,harassment. Every five minutes I get a phone call from you guys.
719,this is a business phone
720,Don't call me no damn.
721,I don't want to talk to anybody.
722,Once called Senior you fucking shag it.
723,I don't want that.
724,I don't need nothing like that
725,Please remove us from your list.
726,No. No
727,Would you take me off your calling list?
728,can you please stop calling?
729,I don't want it.
730,your calling list.
731,I don't need the more.
732,Don't bother me again with this.
733,not right now. Not interested.
734,what the fuck you calling me for?
735,I don't think we've got anything to talk about.
736,I don't need no license.
737,Thank you so much for connecting with the Unlule Insurance Coats on our recorded line.
738,Why do you guys keep calling me?
739,I don't want to do that.
740,You took my number of slides last.
741,Can you delete this number?
742,y'all keep rolling my phone up.
743,No. I don't care for it.
744,Take me out your list
745,Why don't you take me off your call list?
746,Please don't call it.
747,fuck off
748,get my number off this damn list.
749,can remove me from your call list.
750,I don't need any help.
751,Don't need any senior benefits or anything else.
752,Please take me over your calling list.
753,And quick calling me. You prick.
754,can you remove me from this list
755,Can you take me off your
756,he buries his shit in the back yard when he takes a shit
757,I'm not interested in it.
758,do not need no interest.
759,I'm not interested.
760,I hope I care about myself.
761,I don't need to buy anything.
762,You have the wrong number. You have the wrong number. You have the wrong number.
763,fuck off.
764,"Oh, oh. No"
765,"I'd like you to stop calling me,"
766,quit calling this number as whole.
767,Stop calling me
768,I'm not interested. I'm not interested
769,Do not call.
770,Please don't call me back.
771,I don't need none of that stuff. I'm already got this.
772,I think you have the wrong number.
773,"You guys have been calling me consistently,"
774,Not interested
775,Please do not call me anymore
776,I'm not taking out any more insurance.
777,this is about my 15th call.
778,"No, I'm not. No, I'm hang up. I'm hang up."
779,"Becky, would you quit calling me?"
780,I don't need none of that stuff.
781,"I think you have the wrong number, sir."
782,will you guys quit calling me at Medicaid?
783,Please don't call back.
784,Stop fucking calling me.
785,How do I get off of this list?
786,I don't need any more insurance
787,Not really.
788,please remove my name from the list
789,quit calling me
790,I would appreciate it if he would stop calling me
791,You've called the commercial number. Can you please take the number off your list
792,You must have the wrong number
793,You've called a business.
794,"You will fucking die. You will fucking die. You got it, right?"
795,Please don't call here anymore.
796,"Why do you keep calling me? Why do you keep calling me? Every time I block you, find another number of calls."
797,you don't call here anymore.
798,Please take me after you call us.
799,this is the fifth time I've asked you guys to quit.
800,Why don't you go fuck yourself with what these fucking calls I myself on your fucking cost?
801,I would be doing better if you would take me off your call list.
802,I told you to quit calling me.
803,It doesn't stop. It's like so annoying
804,I'm trying to get myself off the list.
805,Why in the world don't you quit calling me?
806,please do not call this number again.
807,I fucking fuck you everybody.
808,You call the business fine.
809,"I've already talked with somebody. I've asked you all to take me off your call list and stop calling me, please."
810,I don't need any of them
811,Will you please stop. Call me.
812,"I'm fucking party, bitch."
813,can you please take me off this list?
814,but I don't need any of that. And I wish you could get me off the list somehow. Thank you.
815,Give your damn head. Don't call me.
816,Put me on your D not call list.
817,Put me on no call list.
818,Can you take me off your call?
819,Take my name off your list
820,Please don't call this number again.
821,Can you take me off your list?
822,not interesting.
823,I'm not interested in any of that.
824,"No, thank you very much"
825,"Could you remove me off your list, please?"
826,Take my name off the call.
827,Could you take me off to the calling list
828,Could you just remove me from this calling one
829,I don't want to
830,Quick calling me.
831,Stop calling me with this shit.
832,So I don't think I want to hear about anything.
833,Please remove me from your call.
834,"Take me off your list,"
835,"Well, stop calling. Well, stop calling."
836,Take me off your
837,I don't need anything
838,people like a son of a bitch.
839,"I'm not only no fucking fixed income. I work my ass off every day, put me on a do not call you."
840,Please don't call me right here.
841,Please quit calling.
842,So please don't call me no more.
843,Please stop calling me
844,I already got this shit done.
845,Delete this number.
846,You have called the Fairfax County Police Department.
847,I'm not going to give you that information.
848,could you take me off
849,This is a business office and industrialization specialist.
850,you don't call me one time today.
851,Please take us off the list.
852,please stop calling.
853,I don't need no burial insurance
854,I just think you called the wrong number
855,Please take this number off your list
856,damn list.
857,Could you take me off your mailing list?
858,"I've got no bullshit today,"
859,please remove our number from your
860,I'm not interested in the final expense insurance.
861,taking her off your calling list.
862,Is there a way I can be taken off? Is there a way I can be taken off?
863,You must have a wrong number.
864,why y'all keep calling
865,put me on my do not call list.
866,"No, I don't think so."
867,would y'all take me off the list?
868,I don't need this call anymore.
869,"I'm kind of not interested,"
870,Can you put me out here? Do not call with
871,Stop calling motherfucker.
872,You have called a business.
873,Can you please take me off your calling list?
874,Please take me off your call list.
875,don't bother me with that shit
876,We don't need that.
877,Don't call us.
878,I'm not interested in any more insurance.
879,Don't call me anymore.
880,why you keep calling me.
881,I'd like my name removed from your call list
882,I don't want my insurance
883,Stop talking.
884,I don't need life insurance at this point
885,"Get out of here, scammer"
886,"nd I wish it could put calling. Take me off your call list, please."
887,I don't need no more.
888,"Becky, please leave my number, leave my number."
889,It's fucking morning.
890,"No, no. I don't want anything right now."
891,Please take me off of you
892,this is a business
893,we don't need any benefits.
894,Please don't call back here again.
895,WLS TV transmitter site. That's who you called
896,"Don't call me,"
897,Do me a favor and remove my fucking number.
898,I don't need it.
899,You're calling me on the same different numbers all the time
900,I don't need any live insurance supplies.
901,I'm not interested though.
902,Did you call me a little while ago?
903,You have a wrong number
904,"Ma'am, what the hell is this gonna keep on bothering me? Please don't bother me on my word."
905,I don't need any senior benefits.
906,Fuck off.
907,bitches?
908,I'm putting on do not call this.
909,Can you take me off
910,I don't need your service
911,I'm not invited between any fucking age and none of your fucking business.
912,What do I have to do to get you to stop calling me
913,I don't need any of the life insurance.
914,Please take me off this list.
915,I wish that you would just quit calling me.
916,I know all day shit
917,add me to your do not call list.
918,there is so many people keep calling.
919,this damn call.
920,please don't call.
921,don't call me no more with it
922,"Can you remove our number from your listing,"
923,m on the Do Not Call list.
924,I don't need to be this. So stop.
925,I have been called twice today and numerous times yesterday and the days before. Please don't call again.
926,I've asked him many times to take this number off your listings.
927,"No, we're not enticing this."
928,I don't need any
929,"No, I don't think you have money to do that,"
930,"Remove my number from your list, please."
931,Can you take us off your call list please
932,. I don't need this
933,I don't need nothing.
934,"Oh, Jesus fucking Christ."
935,I do not need access.
936,Stay from your listing.
937,please take me off your list.
938,I don't need to know
939,I need you to take me off the list.
940,Can you remove this number from your calling list?
941,Are you removing my number from your call list?
942,I want to stop calling me.
943,"Take me off the call,"
944,You call me today
945,stop calling my phone number.
946,Please don't call anymore.
947,I don't think that we're interested.
948,I would like for you not to call me again.
949,I don't want anything else.
950,We're not interested. Thank you.
951,"I want you to take me off my calling list, off your calling list."
952,"I don't need any. So, goodbye"
953,I'm not interested in further insurance.
954,Fuck off
955,I don't need your help.
956,Can you take me off the
957,Go fuck yourself.
958,"No, I should wouldn't"
959,I'm not interested in any of you.
960,I don't want to do anything.
961,I'm not interested in the insurance
962,you need to take my name off your list.
963,That's how I'm going to go fucking...
964,take my number out of your damn calling list.
965,Take me off your calling list
966,Why are you calling a business
967,I'm sick and tired of you people calling me every frickin' day.
968,It's just a waste of time
969,I'm not interested in it
970,I've asked to take my name off your call list.
971,I'm tired of phone calls. Don't...
972,Take me off of the list
973,I'm tired of these pain calls.
974,You're calling from Gateway Auto Parts.
975,I'd like you to stop fucking calling me.
976,this is a business line.
977,This number is on the national do not call
978,Could you delete my number?
979,because I'm not interested
980,I don't talk to somebody about it
981,don't call me
982,No interest. Goodby
983,I wish there was some way that we could get through to you to get you to quick calling us
984,Could you please remove me from your call list?
985,Can you please remove my name?
986,Don't call anymore.
987,So you're going to call me every day?
988,"I'm not interested, ma'am."
989,How come you keep calling me?
990,I'm not even interested
991,Please don't call here again.
992,Stop calling me.
993,"You were supposed to take my name off the call list,"
994,Please remove it from your
995,Please don't call me.
996,You call me everyday
997,I don't need to talk to him.
998,We don't need any of them.
999,none of your business.
1000,You take me off your call list.
1001,You call me about two times a day.
1002,Take my damn phone number out of your
1003,That's none of your goddamn business
1004,Are you fucking idiot?
1005,Please don't call me anymore.
1006,So if you can please remove it from your
1007,I just want to die
1008,So did you get me on doing a call list? I also have to block.
1009,pussy
1010,This is a business office.
1011,I want you to take me off your fucking call-in list.
1012,Don't call us on her.
1013,Please take me off the list.
1014,I don't think I'm interested right now.
1015,"If you could remove my name, it'd save us both some time."
1016,I want you guys to take me off here and do not call this.
1017,Can you quit calling me?
1018,Will you let me fucking talk
1019,. I wish you'd take me off your list.
1020,don’t call here again
1021,Stop fucking calling my goddamn phone.
1022,What kind of a damn phone?
1023,"Oh, it only no interest"
1024,You are about the third time someone has called your company. Please take our name off your list.
1025,So can you please remove the number
1026,Get this off the phone.
1027,you got the wrong number. Don't call us.
1028,"I just fucking cussed you out of here, bitch. Don't call here."
1029,Can you please take my number off this phone call?
1030,"I don't want you to call me again, please."
1031,would you people please quit calling?
1032,you need to not call me anymore.
1033,scam logs
1034,I don't need to give you a pricing
1035,Can you please take me off your call list
1036,I don't understand why they keep calling me
1037,Would you stop calling me
1038,You can take us off that call list
1039,Please hang up and please take my name or if you'll call a list.
1040,"I'd like to be put on the do not call list, please."
1041,I don't think I'd be interested.
1042,You can take me off your list.
1043,"I told you even last week, don't call this number"
1044,I don't like this.
1045,"Take me off your list, please"
1046,Please add me to your do not call list
1047,I wouldn't be interested.
1048,will you please quit calling me?
1049,"no, I don't have to."
1050,you're being a fucking ass right now
1051,"I think you have the wrong number,"
1052,would you come take the number out?
1053,Can I please be taking off the calling list?
1054,I got to tell you people to take my name off your list
1055,I don't need that yet.
1056,I don't know why you guys keep calling me.
1057,you got the wrong number.
1058,stop ringing me.
1059,Don't call me no more.
1060,quick calling
1061,I don't need any extra life.
1062,Not interested.
1063,I'm tired of y'all calling me. I get 10 calls for more days from y'all. Take me off your list.
1064,put me on your do not call list because I'm not a senior and I just keep getting these calls.
1065,I don't need one.
1066,do not call
1067,Take me off your name and calling with us.
1068,I don't need to talk to you all.
1069,I have no interest in a final expense.
1070,"No, no, no, no, no, no."
1071,do not call this number again.
1072,Take me off your call list.
1073,I don't give a fuck about that shit.
1074,I don't want to have that.
1075,Don't call me back again.
1076,I told them to take my name off the list
1077,I don't need your product.
1078,don't need anything whatever you offer.
1079,
1080,Can you remove me from the call?
1081,Take this number off of your list.
1082,I'm not really interested in that.
1083,I'm not interested now.
1084,I don't need none.
1085,I'm just like I was when you called me a couple hours ago. Bye bye.
1086,thank you for calling Usmania Fine Dining
1087,So I don't need it
1088,"Becky, get a real fucking job."
1089,"No, thank you. Right now."
1090,please never call me back again.
1091,I really don't need anything else.
1092,", I'm not interested in this plan"
1093,I'll take me off.
1094,Motherfucker. Is your mama 40?
1095," No, I don't want to talk to them"
1096,You call me a dozen times and I've asked her not to keep calling.
1097,Can you take me off to the police place
1098,I'm not interested right now
1099,I need to move my name from your list.
1100,"No, thank you. No, thank you."
1101,I'm really not interested right now
1102,I have no help.
1103,so you can take me off your list.
1104,Please do not call here again.
1105,"No, I'd rather not."
1106,Put me on a do not call list.
1107,Please do not call me again. Do not call me.
1108,stop calling.
1109,I don't know why you guys keep calling me
1110,Would you please don't bother me again?
1111,His parents even sold my shit so quit calling me
1112,I'm not buying them.
1113,take me off to this
1114,I think you have the wrong number. I'm not.
1115,Do not call here again.
1116,Don't call me no more
1117,"No, Mom, thank you."
1118,please stop wasn't calling me.
1119,I don't need no burial law insurance.
1120,you guys keep calling me.
1121,"No, thanks"
1122,how about you quit fucking calling me?
1123,fucking
1124,put me on your do not call list.
1125,Could you pick me off the list?
1126,"Fuck y'all,"
1127,would you just take me off your list?
1128,Can you please remove my phone number from your list?
1129,I don't think I'm interested by investing right now
1130,I'm trying to get tired of 100 people calling me every day.
1131,"Go fuck yourself, yes."
1132,Do you like sucking dick?
1133,I request that you put my name and my phone number on a do not call list.
1134,We don't need not be.
1135,We don't want to talk to you.
1136,Not worth a shit. I just buried my wife and if you fucking people don't quit calling
1137,I'm doing fancy quick calling.
1138,I'm not even looking for you.
1139,I don't need any more help.
1140,I would like for you to quit tall on these scam likely.
1141,Take me off your calling list.
1142,Please remove my name from your list.
1143,I won't be needing any of this time.
1144,"Fuck you, your motherfucker"
1145,Take me off the call list.
1146,y'all keep calling me.
1147,Please do not call anymore
1148,I wish you people a quick call on me please.
1149,And I would also guarantee we go through this like three times a week. And I have repeatedly asked to be moved from your
1150,Remove my number from your lid.
1151, Not interested. 
1152,Just take my number off your list.
1153,Representative.
1154,Please take my number off your call list.
1155,I do not call it.
1156,I don't need two of them
1157,you call me 17 times this and I told you that I answer.
1158,You're speaking with a dispatcher at a business.
1159,I have no interest in talking to him.
1160,can you please take me off your call list
1161,Take me off your list
1162,I'm not ever going to die. You know... I'm not going to die.
1163,Who the fuck are you?
1164,take me off the list.
1165,Please take me off your list
1166,You called the hospital
1167,So take me off your lips.
1168,I'm not interested
1169,I don't need a final expense.
1170,take me off of your call list
1171,I don't need it
1172,Fuck you
1173,. I'm not interested. Sorry.
1174,Please take me off your call.
1175,I don't need any.
1176,I wish you all a quick calling
1177,I do not want insurance.
1178,Would you stop calling here?
1179,I'm not in the middle of your funeral.
1180,please don't call Sam on the phone.
1181,Could you just stop calling me
1182,Stop fucking call
1183,Can you please stop calling my phone
1184,Would you please stop coming?
1185,let me tell you I have to tell you not to call me.
1186,I'm going to ask again that you remove me from the call list and do not call this number again
1187,you guys stop calling. This is a business line.
1188,"No, thank you. "
1189,Can you take me off your call list
1190,I would like for you to remove us from your call list.
1191,"No, no, no, no, thank you."
1192,"Kiss my ass. Stop calling this goddamn number, you fucking jackass."
1193,And you rather the fucking guy. You fucked up.
1194,I'm not interested in all of you
1195,I don't need no life insurance.
1196,I don't need to.
1197,would you quit calling me
1198,I'm not interested in anything.
1199,I'm not an interest.
1200,"you've been favor of the shut up, please. Take my off-road list."
1201,could you take me off your call list please
1202,Do not call this please
1203,I'm not needing nothing.
1204,"Could you take me off your call list,"
1205,"We don't need it,"
1206,you've called me already today
1207,could you take us off the list?
1208,I got everything set up
1209,I'm really not interested in
1210,Who is fucking calling me?
1211,how many times are you going to call me?
1212,I don't need to get it
1213,. I am not interested in anything else.
1214,please just don't call again.
1215,this is like the third time you've called this morning.
1216,You people have been calling me every day for like two months
1217,I'm not interested in this. I'm not interested in this.
1218,Take my name and call me
1219,it was known for damn good.
1220,"No, I don't like that."
1221,You need to go fuck yourself.
1222,you get a carrot in sticking in your asshole
1223,I don't know why you keep calling me.
1224,don't call me.
1225,"I don't need,"
1226,"Why don't you just hang up, you fucking idiot."
1227,Somebody already call me
1228,I'm not interested right now.
1229,I don't want it
1230,"Can you get me up the list, please?"
1231,take us off your list
1232,I'm fucking shit over at my house.
1233,They were supposed to take my number and not call me anymore because there's a problem.
1234,I don't need you
1235,put me on a no-call list.
1236,"At until we stop calling, yeah, got in somewhere."
1237,I wish you guys would stop calling my number.
1238,Stop calling this number.
1239,please don't call no more.
1240,you're talking to the wrong person
1241,Y'all won't stop calling me. So me and my husband is going to sue.
1242,Put me on your no call list.
1243,"can you not call me anymore please? Okay, can you not call me anymore please?"
1244,please don't call again
1245,Can you put me on the do not call
1246, I'm not interested in insurance
1247,taking us off your call list
1248,I don't want to know nothing now.
1249,do not call me back.
1250,fuck this shit
1251,we are a business. So if you could take us off the
1252,I don't think I'm interested
1253,I would appreciate you guys not calling me anymore.
1254,I've asked several times if you guys had quit calling me
1255,can I opt out of having this phone call?
1256,we're not interested.
1257,I'm not interested in life insurance.
1258,not interested.
1259,So take my name off your list.
1260,I'm a lot of fucking senior and go fuck yourself.
1261,"No, I don't want"
1262,I am not interested. I'm not interested
1263,. I don't need any insurance
1264,I don't need that coverage
1265,This is a business line. And I appreciate if you guys stop calling it.
1266,o could you please take us off your list?
1267,"how many times do you want to call, buddy"
1268,"I didn't want... No, no, no, no. I don't want"
1269,this is my daughter's phone you're calling. So if you could just remove the number
1270,I've asked you guys not to call me anymore. So could you not call me anymore?
1271,Take me off
1272,I think we have the wrong numbers here. Sorry.
1273,No ma'am.
1274,You call me so many times
1275,I don't need the coverage
1276,You get the wrong number.
1277,You seem to keep calling for some stupid reason
1278,Can you back off?
1279,I want you to take me off your list.
1280,And you guys call from so many numbers.
1281,"No, ma'am,"
1282,Please kill yourself.
1283,"don't call me anymore,"
1284,Not really
1285,I can't talk right now.
1286,I want you to stop calling me.
1287,keep getting calls from you all.
1288,You can call me for this shit.
1289,put me on your do not call us?
1290,I've received this call many times
1291,please put me on the do not call list because they call me 1200 times a day?
1292,I don't need an insurance
1293,Take me off the list.
1294,Take me off your call list
1295,I don't need any shit.
1296,I don't need this.
1297,I don't need any additional insurance. Thank you
1298,Please don't call here again
1299,this is a four-time job trying to scam people in. I mean...
1300,I don't need your insurance.
1301,Why do you guys call me every single day
1302,Please take us off your call list
1303,"No, no, no. I don't need all of that"
1304,"I'm not interested, thanks"
1305,I'm not only no damn benefit.
1306,I don't need any insurance mail.
1307,you called me this morning James
1308,take me off your calling list
1309,You gonna let me fuck your big dick?
1310,Don't call my phone anymore.
1311,I'm not interesting.
1312,I don't need any lab insurance
1313,How do I get removed from your call list?
1314,please quit calling me
1315,I wish your company would stop calling me.
1316,you really need to stop calling me.
1317,I'm not interested in.
1318,"I'm still alive, dog"
1319,Please don't call this number again
