,text
694,is there any way that you can take me off your list of people to call?
695,somebody already called me about that. Okay.
696,I'm really not interested in
697,Who's the fucking carrier?
698,You gonna let me fuck your big dick?
699,Could you take me off to the calling list
700,I don't need a final expense.
701,I don't need this
702,I'll be a lot better if you guys could call me all the time
703,Please do not call anymore
704,I'm not interested in life insurance
705,y'all keep rolling my phone up.
706,WLS TV transmitter site. That's who you called
707,you stop calling me.
708,This is a scam call.
709,I don't need the more.
710,So you can take me off your little list.
711,I don't buy stuff for people that call me on the phone.
712,Take me off your list.
713,I'd like you to stop fucking calling me.
714,Do me a favor and remove my fucking number.
715,you don't call here anymore.
716,I don't need no more.
717,do you enjoy wasting my time every day
718,Can you remove me off your card and list
719,I really am not interested.
720,I'm not interested in it.
721,Take me off your call list
722,Quick calling
723,I don't need any of that.
724,I don't think I'm interested by investing right now
725,"No, no, no, no, no, no."
726,don't call me back. Take my name off.
727,I told you not to call me
728,fuck yourself.
729,I asked you guys to stop calling my numbers.
730,you're being a fucking ass right now
731,what the fuck you calling me for?
732,"You keep calling a business. You just call me about three, four times a day."
733,Please take me off your call list.
734,Can you take me off your call?
735,This is a hospital room.
736,please remove me from your list.
737,let me tell you I have to tell you not to call me.
738,I wish your company would stop calling me.
739,I don't need any extra life.
740,I don't think I'd be interested.
741," No, I don't want to talk to them"
742,Please don't call back here again.
743,this is about my 15th call.
744,None of your fucking business.
745,"No, no."
746,I'm not impressed with that.
747,"No, no. I don't want anything right now."
748,you guys keep calling me.
749,"Maybe when I'm dead, I have no way of knowing if I'll pay for it and when I get. So that's why I don't go for that."
750,Don't bother me again with this.
751,Do not call this please
752,I'm putting on do not call this.
753,I'd like you to quit calling me
754,I'm not interested in any more insurance.
755,Stop fucking call
756,We wouldn't be interested.
757,"No, thanks"
758,I don't deal with the phone.
759,I don't give a fuck about that shit.
760,No. Thank you
761,Quit calling me
762,can remove me from your call list.
763,"No, I don't need any new benefits"
764,could you take me off
765,this is a hospital and we need this number removed from your
766,People keep calling me. It's driving me crazy.
767,fucking bother fucking ass lackin' in the morning. This is shit.
768,I am having sex with your mom.
769,"y'all just keep calling me, and I'm tired of it."
770,this is my daughter's phone you're calling. So if you could just remove the number
771,you guys keep calling me all the time. Can't you take me off your damn list?
772,Please take me off of your land
773,So if you can please remove it from your
774,put me on my do not call list.
775,we wouldn't be interested.
776,I don't need life insurance.
777,I don't need any more insurance
778,I don't need to do that.
779,Stop calling me
780,I ain't a fucking senior.
781,Can you remove me from the call?
782,Please don't call me again.
783,Can you take us off your phone with you
784,I request that you put my name and my phone number on a do not call list.
785,"No, no, no. I don't need all of that. Thank you very much"
786,Please hang up and please take my name or if you'll call a list.
787,"Fuck you, your motherfucker"
788,don't bother me with that shit
789,You don't need to call back no more.
790,Put me on your do not call it.
791,I'm tired of y'all calling me. I get 10 calls for more days from y'all. Take me off your list.
792,quit calling me
793,. I am not interested in anything else.
794,"I'm still alive, dog"
795,"No, not at this time,"
796,I've asked you guys several times already to take me off your call list.
797,You take me off your call list.
798,I don't want my insurance
799,don't call me again.
800,so take me off the list
801,No ma'am
802,You can call me for this shit.
803,"We're not interested,"
804,This is the business center.
805,I'm on the National Do Not Call for a S***.
806,please take my name and number off of your calling list.
807,I want to fucking tell you and I find you and beat this fucking shit out of you.
808,I won't need it
809,you can take me off your phone list.
810,"No, I don't think so. Thank you."
811,Can I go on a do not a call list?
812,"you've been favor of the shut up, please. Take my off-road list."
813,Please take me off your call.
814,"No, not at this time."
815,would you just take me off your list?
816,I'm not invited between any fucking age and none of your fucking business.
817,why don't you just tell me what you want and then take my name off your call list
818,I'm not interesting.
819,I don't need no shit. Let's get out of my phone.
820,It's not in your business.
821,I don't need no live insurance.
822,What do I have to do to get you to stop calling?
823,This is harassment.
824,"I just fucking cussed you out of here, bitch. Don't call here."
825,I wish you people a quick call on me please.
826,Would you please put me on Do Not Call?
827,I'm fucking horrible since you called. You called to put me on the call list.
828,Don't need any senior benefits or anything else.
829,no thank you.
830,I don't need life insurance at this point
831,You take me off your call list
832,I don't need none of that stuff. I'm already got this.
833,I can't participate with anything
834,I don't need any senior benefits.
835,I don't need to know
836,"No, I'm not."
837,"No, no, I don't need"
838,"I've got no bullshit today,"
839,How do you keep on calling people bullshit
840,This is a business
841,y'all keep calling me.
842,I do not call it.
843,I don't think I'm interested right now.
844,you might have the wrong number
845,So what would you like to learn how a partner appreciate that motherfucking piece shit?
846,Take me off of your call list.
847,I don't want to talk about burial right now
848,So take me off your list.
849,remove this number from your calling list.
850,will you please quit calling me?
851,Could you please take me off your list?
852,not interesting
853,I'm not interested right now
854,You're calling list.
855,"Would you take me off your list,"
856,Please put me on a do not call list.
857,"Fine, but I don't need any senior benefits"
858,fuck.
859,Take me off your list
860,Go fuck yourself.
861,. Fuck all you
862,Put me on your DNC list.
863,could you take me off your call list please
864,That's not okay.
865,. I wish you would never call me again.
866,you've called me a hundred times.
867,Can you guys stop calling this number please?
868,This is the 10th call. Do not call me again.
869,I won't be needing any of this time.
870,Please take me off your list
871,Did you call me a little while ago?
872,please stop calling.
873,if you took me off your call list
874,"No, thank you. "
875,I don't want to
876,please stop calling us.
877,I wish every one of you people would take me off your list and put a call in the every single day.
878,Can you stop calling my line?
879,"If you ever call me again, I'm going to please put you in jail."
880,My name and number off of your list.
881,I wouldn't be interested.
882,I'm not interested in any life insurance.
883,how about you quit fucking calling me?
884,Don't need any Becky
885,Why do you keep on calling me?
886,will you guys quit calling me at Medicaid?
887,Can you not stop calling here
888,y'all do not call.
889,why y'all keep calling
890,You call me everyday
891,I'm not even ready.
892,"don't call me anymore,"
893,I have a number you dumbass.
894,please take me off your list.
895,Fuck off
896,Put me on the do not call
897,Put me on a do not call list.
898,Stop calling my phone
899,Why do you all keep calling me?
900,Please don't call back.
901,Stay from your listing.
902,Don't need it. Don't need it.
903,You call me 10 damn times about this
904,"Take me off your list,"
905,Please remove this from your list.
906,I don't need any shit.
907,"No, thank you. That's okay. Thank you for calling."
908,I don't need none of that.
909,I don't need that. I don't need tha
910,"Oh, but I'm not interested."
911,I've told you to freak easily that to call me.
912,I'm not interested in the final expense insurance.
913,I don't need to give you a pricing
914,I don't need this call anymore.
915,Take me off your lips.
916,You people have been calling me every day for like two months
917,Just take me off the call
918,get my number off this damn list.
919,Remove my number from your lid.
920,you guys stop calling.
921,"I'm not interested, ma'am."
922,Remove me from your calling.
923,I have no interest in talking to him.
924,I just want to die
925,I don't know.
926,Who is fucking calling me?
927,Why you people keep calling me?
928,Can you remove me from your callers
929,"I'm fucking party, bitch."
930,Don't call this number number.
931,you are damn liar.
932,Can you please take me off your call list
933,Representative.
934,If you're a please take her off the call list and quit calling.
935,I don't want to do that.
936,Can you please remove my phone number from your list?
937,this damn call.
938,I have been asked to have my number removed from this call list.
939,We're not interested. I
940,You must have a wrong number.
941,not right now. Not interested.
942,Don't call me back.
943,", I'm not interested in this plan"
944,I'm not interested. I'm not interested.
945,You have called the Fairfax County Police Department.
946,I want you to remove my number from your call list.
947,please stop calling me.
948,Will you please stop calling me
949,Shut up.
950,don't need anything whatever you offer.
951,I'll be real good when you take my name off the list.
952,Don't want to talk to you.
953,You're calling from Gateway Auto Parts.
954,"I've asked about 1,000 times to have my number taken off of your list"
955,You've been calling me every day.
956,you're calling a hospital home
957,How won't you put me on a no-call list?
958,Please quit calling.
959,please stop calling me
960,Please take us off your
961,you got the wrong number. Don't call us.
962,"could you please take my number off your list, please?"
963,no. I'm not ready.
964,please don't call again.
965,You stupid motherfucker.
966,We... You call the business
967,So don't call me back.
968,this is like the third time you've called this morning.
969,His parents even sold my shit so quit calling me
970,I want you to take me off your list.
971,how many times are you going to call me?
972,I don't need no of that.
973,put me on your do not call list because I'm not a senior and I just keep getting these calls.
974,I don't need funeral expenses
975,Take me off to this
976,I don't want it
977,Is illegal?
978,I've asked you guys to stop calling me.
979,Fuck you
980,why don't you just fuck off?
981,I don't need that
982,Please remove this number from your listing.
983,"You will fucking die. You will fucking die. You got it, right?"
984,"I don't need insurance now,"
985,Take me off your list right now.
986,I don't need you
987,I'm not really interested in that.
988,I'm not even interested
989,I am not interested in a life insurance.
990,I'm going to report it to whoever I can report it to from the police department to FCC and everybody else. Do not call.
991,Do not call here again.
992,"I don't give a shit, don't go to hell."
993,"I don't need any. So, goodbye"
994,you don't have to do all that crap.
995,I am not interested
996,your calling list.
997,Please don't call me back again
998,You call me so many times
999,Please keep an eye on your list.
1000,You call me today
1001,Take me off the call list.
1002,You have the wrong number.
1003,Can you take me off your call list
1004,this is the fifth time I've asked you guys to quit.
1005,Stop calling my ****
1006,Can you put me on the
1007,I am not interested in this right now.
1008,you did that crap.
1009,I don't want to answer.
1010,You got the wrong number
1011,So take me off your lips.
1012, I'm not interested.
1013,I don't want you to fucking call me no more at home.
1014,Please take me off the call list.
1015,I'm not even looking for you.
1016,"Becky, get a real fucking job."
1017,"I think you've got the wrong number,"
1018,I don't think that we're interested.
1019,because I'm not interested
1020,"No, not interested. Not interested"
1021,Please take me off the list.
1022,"can you not call me anymore please? Okay, can you not call me anymore please?"
1023,"I'm not interested,"
1024,"No, thank you. No, thank you."
1025,I'm not fucking calling you.
1026,I am not interested in health insurance.
1027,Please put me on the do not call.
1028,Would you please stop coming?
1029,I'm not interested in a life insurance.
1030,I don't want to do anything.
1031,Can you take me off
1032,Stop calling people. You're really annoying.
1033,"Don't call me,"
1034,I don't need life insurance
1035,"I'd like to be put on the do not call list, please."
1036,Pick my name off the list please.
1037,Every fucking day.
1038,The guy that called me this morning
1039,No interest. Goodby
1040,I don't need to get it
1041,"I'm kind of not interested,"
1042,Can you please take me off your calling list?
1043,I don't want any
1044,I don't need that to help my own financial estate.
1045,I don't need that stuff anymore.
1046,Would you take me off your calling list?
1047,So you don't have to call me more with this. So you don't have to call me more with this.
1048,Will you stop calling this number?
1049,Do not call.
1050,Could I get put on the do not call
1051,We don't need it.
1052,I'd like to learn more about your grandma's asshole
1053,bitch.
1054,I'm not interested in anything
1055,"Remove my number from your list, please."
1056,"Good, bitch, I don't give a damn who you are, bitch. Stop calling my goddamn..."
1057,Doesn't need to be called by anything. It's a business. Please don't call us number again.
1058,why you keep calling me.
1059,Is there any way y'all could take my number out this
1060,Don't call me no damn.
1061,Somebody already call me
1062,I asked you not to call me again.
1063,"Becky, please leave my number, leave my number."
1064,We wouldn't be interested in any insurance
1065,do not call again
1066,I'm not interested in any of you.
1067,I want you to take my number off.
1068,"you're a phony and a fraud, so stop calling."
1069,I'll take me off your phone list.
1070,Please don't call me any more.
1071,You guys comment 10 times a day.
1072,I don't need any senior benefits
1073,I don't appreciate this call.
1074,They were supposed to take my number and not call me anymore because there's a problem.
1075,I'm fucking shit over at my house.
1076,Can you please quick calling?
1077,Go fuck yourself!
1078,I don't want to know nothing now.
1079,Could you take my number off your
1080,"No, I'm really not interested, ma'am."
1081,What the fuck
1082,Can you take me off your
1083,I just wish you guys stop calling me just a waste of all of our time then.
1084,I'm a lot of fucking senior and go fuck yourself.
1085,stop calling over here.
1086,Please take me over your calling list.
1087,"don't need anything,"
1088,"Why do you keep calling me? Why do you keep calling me? Every time I block you, find another number of calls."
1089,Put me on your no call list.
1090,Take me off your calling list.
1091,"No, I don't need it"
1092,you call me every day
1093,"I don't need,"
1094,"No, I should wouldn't"
1095,I don't talk to somebody about it
1096,I don't need any insurance mail.
1097,Please delete my number
1098,I don't need none of that stuff.
1099,I do not need access.
1100,I've done talk to 20 people a bit about that
1101,don't call me.
1102,we are at the restaurant. Now we are giving the business hour.
1103,"but no, thank you."
1104,I will contact if you do not quit calling this number or race this number.
1105,Please remove my name from your list.
1106,you guys stop calling. This is a business line.
1107,I fucking fuck you everybody.
1108,"Becky, would you quit calling me?"
1109,I cannot afford
1110,", I'm not interested."
1111,take me off and calling Leah.
1112,please stop calling in.
1113,Quit calling me all the time.
1114,Please don't call anymore.
1115,Would you please take me off of your call list? I'm tired of getting these phone calls.
1116,You are about the third time someone has called your company. Please take our name off your list.
1117,"I've already talked with somebody. I've asked you all to take me off your call list and stop calling me, please."
1118,Please don't call here again.
1119,I don't need anything like that
1120,You've called a business.
1121,your calling the business.
1122,You have called a business.
1123,"I'm not interested, thanks"
1124,I don't want to do this
1125,Remove him from your
1126,. I'm not interested. Sorry.
1127,I'm not needing nothing.
1128,Is this a real person or a fucking computer
1129,I'm not interested in any.
1130,I've received this call many times
1131,please take me off the list.
1132,quit fucking calling me
1133,"No, no, no, no, no, no. I don't want it."
1134,You can take this phone number off your list
1135,Your bothering me.
1136,I'm tired of getting phone calls.
1137,you really need to stop calling me.
1138,Please take this number off of your list
1139,we're not interested
1140,I have asked you guys several times to stop calling me.
1141,Why don't you go fuck yourself with what these fucking calls I myself on your fucking cost?
1142,could you take us off the list?
1143,This is a business office.
1144,please quit calling.
1145,thank you for calling Usmania Fine Dining
1146,never call me again
1147,Same as I was last time you called.
1148,Is this a spam call
1149,I don't need your money.
1150,I can tell them to go fuck himself.
1151,you need to take my name off your list.
1152,You call me a dozen times and I've asked her not to keep calling.
1153,I don't need that.
1154,We don't need anything.
1155,you guys will stop calling me.
1156,I'm not interested in all of you
1157,Don't need anything.
1158,Fuck off.
1159,I don't want to talk to you
1160,I'm not interested in that.
1161,Thanks for fucking talking about me.
1162,So I don't really need to get in
1163,"no, I don't have to."
1164,No. No.
1165,I wish everybody would stop calling me.
1166,I want you to take me off your fucking call-in list.
1167,". I'm just talking about your do not call list, please."
1168,Please set me off your list.
1169,But take me off the list
1170,Take my name off your list.
1171,I hope I care about myself.
1172,Can you take me off the call list?
1173,I don't need
1174,Please don't call me again
1175,can you please take me off your call list
1176,I'll take the action off you.
1177,we are a business. So if you could take us off the
1178,Can I please be taking off the calling list?
1179,Put me on your D not call list.
1180,you need to stop calling.
1181,You know what? I don't want to do this
1182,I don't need any help.
1183,Stop fucking calling my goddamn phone.
1184,I don't want anything else.
1185,You called the hospital
1186,I'm tired of these pain calls.
1187,You're a line sack of shit scammer.
1188,"No, I don't want"
1189,I don't think about it.
1190,Could you delete my number?
1191,"Never mind, no"
1192,I'm worth a shit. I'm still alive and kicking.
1193,". I don't need insurance,"
1194,You'll call me like five million times.
1195,Why don't you take me off your call list?
1196,please don't call Sam on the phone.
1197,I don't need any insurance.
1198,Take me off of the list
1199,damn list.
1200,Fuck you guys. Stop calling.
1201,"Can you remove our number from your listing,"
1202,No ma'am.
1203,I have no help.
1204,we're not interested at all
1205,We don't want to talk to you.
1206,Would you please don't bother me again?
1207,"I didn't want... No, no, no, no. I don't want"
1208,Please kill yourself.
1209,I would be doing better if you would take me off your call list.
1210,I think we have the wrong numbers here. Sorry.
1211,I don't want you to take any information
1212,I think you got the wrong number.
1213,"no, I don't need you"
1214,Please don't ever call me anymore
1215,You call me about two times a day.
1216,I don't know why you guys keep calling me
1217,I wish I could quit calling me six times a day.
1218,Stop calling me. Fuck off.
1219,Can you guys please stop calling me?
1220,motherfucker
1221,Don't call my phone anymore.
1222,"No, Mom, thank you."
1223,you're calling an elementary school.
1224,put me on a no-call list.
1225,I don't need anything
1226,Please don't call me back.
1227,You've called the commercial number. Can you please take the number off your list
1228,I don't need you.
1229,I don't need any other.
1230,"No, no. I'm sorry."
1231,but I'm not interested right now
1232,Quick calling me
1233,you got to stop calling me
1234,"No, no, no. I don't need all of that"
1235,Five people call me to while you want over the same thing they don't tell you
1236,You can take me off your list.
1237,Are you fucking idiot?
1238,I'm not.
1239,"No, thank you."
1240,Will you please quit calling me
1241,I'm not taking out any more insurance.
1242,please don't call again
1243,Y'all quit calling me
1244,I have got this call so many times and it's so annoying.
1245,I'm not interested. I'm not interested
1246,I don't need to talk to you all.
1247,I'm not interested right now.
1248,I'm all shit.
1249,So take my name off your list.
1250,
1251,Take me off your call.
1252,you've called me already today
1253,You can take me off
1254,You took my number of slides last.
1255,"No, be honest with you. I don't need anything."
1256,Is there a way I can be taken off? Is there a way I can be taken off?
1257,How many times are you going to call me?
1258,quick calling here. 
1259,you're calling to another main treat school.
1260,"I'd like you to stop calling me,"
1261,You take my name off your list.
1262,Put me on no call list.
1263,pussy
1264,this is a do not call number.
1265,I don't need an insurance
1266,I don't need your
1267,I already got this shit done.
1268,can I opt out of having this phone call?
1269,Please take us off the list.
1270,Would you please not call my number again
1271,stop ringing me.
1272,don't call no more.
1273,I'm not interested in further insurance.
1274,I'm not ready
1275,Can you take me off your list
1276,I don't need any
1277,Please quit calling. Please quit calling.
1278,Take me off
1279,put me on a do not call this.
1280,I'm not interested 
1281,y'all keep calling.
1282,We're not interested. Thank you.
1283,I'm not
1284,don't bother calling me.
1285,"No, I am. No,"
1286,Why would I be getting these calls every two minutes?
1287,take me off your calling list
1288,"Oh, Jesus fucking Christ."
1289,Quit calling me.
1290,but I don't need any of that. And I wish you could get me off the list somehow. Thank you.
1291,I don't need to.
1292,I don't need any lab insurance
1293,I don't think I was interested.
1294,"Ma'am, what the hell is this gonna keep on bothering me? Please don't bother me on my word."
1295,You have a wrong number
1296,"I mean, why do you all even call me"
1297,"No, I wouldn't."
1298,please remove my number from your call list.
1299,But you don't need to call me no more
1300,I really don't need anything else.
1301,I keep people don't call me anymore.
1302,Can you please remove my name?
1303,I'm going to go fuck yourself.
1304,"No, I'm not ready"
1305,Don't call me anymore.
1306,quick calling
1307,I don't need your insurance
1308,fuck off
1309,This is a business line.
1310,would you come take the number out?
1311,do not want no life insurance
1312,Don't call me no more
1313,And you go fuck yourself James?
1314,I'm not interested in thank you.
1315,Y'all done called 15 times this morning.
1316,You realize you're calling Erie Insurance with this scam
1317,"Take me off your call list,"
1318,"I'm not only no fucking fixed income. I work my ass off every day, put me on a do not call you."
1319,I don't need them.
